Pod,Setup,Rank,Points Earned,Total Points,Name(s),"Victory
Pile 1","Victory
Pile 2","Total
VP",Win?,,Turns,,Escaped Villains,,Points per Turn,,Total Rank Points,,VP Difference,Bystanders Rescued,Cards Undercover,Cards Left in Villain Deck,,,,,,,Attempt 1 Hero Choices,,Attempt 2 Hero Choices,,Attempt Submitted,Fun Level,Comments,,,Results Of Week:
,,,,,,,,,,,,,,,,,,,,,,MS,ST,V,H,B,O,Total,1,2,1,2,,,,,,5
,,,,,,,,,Rank,Points,Rank,Points,Rank,Points,Rank,Points,,,,,,,,,,,,,,,,,,,,,,
46,Access Denied,1,(+10),41,Lukas,80,41,121,1st,Yes (5.5),3rd,25 (8),1st,0 (5.5),1st,4.84 (10),29,,39,26,11,2,4,7,5,1,0,19,Red Guardian,Korg,Red Guardian,Korg,Second attempt,5,"Right place, wrong time worked incredibly well with the excessive sidekicks produced by Magic. Tie that together with some strategic unleashing of the red guardian created massive damage.",,,
,,2,(+9),44,R3DJ0N,34,87,121,1st,Yes (5.5),4th,26 (7),1st,0 (5.5),2nd,4.654 (9),27,,53,22,5,4,5,6,2,1,0,18,Hiroim,"Joe Fixit, Grey Hulk",Hiroim,"Joe Fixit, Grey Hulk",First attempt,5,"Luckily had enough elite assassins  come out so Indestructible Man didn't hold me up. Hiriom did his job. Joe Fixit was supposed to facilitate she-hulk and bribe the high attack villains, he didn't show up much in the first game. Would've been faster but was one attack short for the MM several times and the extra 5 goblins didn't help either.",,,
,,3,(+8),46,Avataristche,29,69,98,1st,Yes (5.5),2nd,24 (9),1st,0 (5.5),4th,4.083 (7),27,,40,16,6,2,6,8,3,1,0,20,Lady Thor,Man-Thing,I did not make a second attempt.,I did not make a second attempt.,First attempt,5,"Jade Giantess revealed 12 cards for 15 atk, followed by Wield the Soulsword, so i finished JJJ, Indestructible and Madelyne (twice) in one turn.
Howard revealed 11 bystanders during the game and rescued 0, the traitor ^^",,,
,,4,(+7),44,Jean-Sébastien & Geneviève,96,17,113,1st,Yes (5.5),5th,27 (6),1st,0 (5.5),3rd,4.185 (8),25,,79,25,4,2,5,5,3,0,0,15,"Namor, the Sub-Mariner",Man-Thing,"Namor, the Sub-Mariner",Man-Thing,Second attempt,5,"Hoped for Howard and Magik to do better with Man-Thing, but Namor an She-Hulk are very good together and won us the game.",,,
,,5,(+6),39,Redblock,36,47,83,1st,Yes (5.5),1st,21 (10),1st,0 (5.5),7th,3.952 (4),25,,11,14,5,2,5,12,4,1,0,24,Amadeus Cho,Red Guardian,I did not make a second attempt.,I did not make a second attempt.,First attempt,5,"Heroes given where very strong, Howard + Magic giving him general sidekicks is already strong, and I added Red Guardian. She Hulk is also very good, and I maxed her use by adding Amadeus for even more Outwit. Setup itself is also great, just indestructible man gave problems, as assassins refused to come out.",,,
,,6,(+5),36,realdanl,49,71,120,1st,Yes (5.5),7th,30 (4),1st,0 (5.5),6th,4 (5),20,,22,24,6,2,2,6,2,0,0,12,Hiroim,Amadeus Cho,Hiroim,Amadeus Cho,Second attempt,3,"Two very similar games, stat-wise, even down to the same points difference between players.  Things were flipped by the deck strategies, though.  The first attempt, Hiroim took top marks with support from Howard and Magik, but the second attempt She-Hulk backed by Amadeus an a smattering of others took the honors.  Tells me both were solid strategies, it was only down to HQ luck that made one come together better in a given game.",,,
,,7,(+4),36,Snash108,53,80,133,1st,Yes (5.5),10th,33 (1),1st,0 (5.5),5th,4.03 (6),18,,27,38,3,1,1,8,1,1,0,12,Red Guardian,Hiroim,Red Guardian,Hiroim,Second attempt,5,"Built a covert deck, and a Recuit/smash deck. Game would have gone far faster if the Elite Assassins hadn't been so late to the party!!",,,
,,8,(+3),34,piplup1112111,56,31,87,1st,Yes (5.5),6th,29 (5),1st,0 (5.5),10th,3 (1),17,,25,11,7,0,2,12,2,0,0,16,Red Guardian,Gladiator Hulk,I did not make a second attempt.,I did not make a second attempt.,First attempt,5,"Red Guardian didn't do as much as I would've hoped, but gladiator hulk was really helpful",,,
,,9,(+2),37,the.melk.man & Snapcity57,48,70,118,1st,Yes (5.5),8th,32 (2.5),1st,0 (5.5),8th,3.688 (3),16.5,,22,30,2,1,2,8,1,0,0,12,Caiera,"No-Name, Brood Queen",I did not make a second attempt.,I did not make a second attempt.,First attempt,2,So much lurking melk,,,
,,10,(+1),36,GZUZROCKS & DaBomb,60,40,100,1st,Yes (5.5),8th,32 (2.5),1st,0 (5.5),9th,3.125 (2),15.5,,20,15,3,1,2,5,3,1,0,12,Gladiator Hulk,"Joe Fixit, Grey Hulk","Namor, the Sub-Mariner",Namora,Second attempt,4,This was challenging and fun. First game was disappointing. Scheme twists came out to quick and we lost just as our engine was getting started. Honestly felt a little shaky with our picks and so we went with bagel’s stream idea of namor and namora which went better. The game really could go sideways quick sir song on the timing of scheme twists and random mastermind placement. It was fun but very random. I feel like 2nd game could have gone south just as quick depending on how the villain deck shuffled out. She hulk was an all star and threw A LOT of trucks with her transformed card this go round.,,,
,,11,,,,,,,,,,,,,,,,,,,,,,,,,,,,,,,,,,,,
,,12,,,,,,,,,,,,,,,,,,,,,,,,,,,,,,,,,,,,
47,We Fought a Zoo,1,(+10),38,Adrian Miller,37,27,64,1st,Yes (6),1st,22 (9.5),1st,0 (6.5),5th,2.909 (6),28,,10,3,0,4,2,10,2,3,0,21,Stepford Cuckoos,Mirage,Stepford Cuckoos,Mirage,Second attempt,5,.,,,
,,2,(+9),38,ChuckBauer,44,48,92,1st,Yes (6),5th,29 (6),1st,0 (6.5),2nd,3.172 (9),27.5,,4,4,0,2,4,3,0,4,0,13,Wolfsbane,Mirage,Wolfsbane,Mirage,First attempt,4,Brought a bunch of extra 3-cost cards with Wolfsbane and Mirage to help make M even better. Worked pretty well!!!,,,
,,3,(+8),38,OleRockyTop,35,35,70,1st,Yes (6),3rd,23 (7.5),1st,0 (6.5),4th,3.043 (7),27,,0,3,0,2,7,6,4,3,0,22,Iceman,Sunspot,I did not make a second attempt.,I did not make a second attempt.,First attempt,3,One hand went blue and the other focused mainly on M. Lots of XMen and blue for synergy. Ended up dead even between the hands on points.,,,
,,4,(+7),35,Techfiend,41,17,58,1st,Yes (6),1st,22 (9.5),1st,0 (6.5),7th,2.636 (4),26,,24,10,0,3,4,11,4,2,0,24,Apocalyptic Black Widow,Jean Grey,Apocalyptic Black Widow,Jean Grey,Second attempt,2,"Not a fan of schemes or MMs that remove cards from my deck, and this had both.",,,
,,5,(+6),35,Off the Cuff & hanoott,56,39,95,1st,Yes (6),6th,30 (4.5),1st,0 (6.5),3rd,3.167 (8),25,,17,13,0,2,5,4,2,1,0,14,Jean Grey,Wolfsbane,Jean Grey,Wolfsbane,First attempt,3,Professor X's rare is a great one for this Scheme; nabbing Villains as Heroes that can't be sent to the zoo feels like an inverse of the Scheme itself,,,
,,6,(+5),33,Bakatora971,44,21,65,1st,Yes (6),3rd,23 (7.5),1st,0 (6.5),6th,2.826 (5),25,,23,8,0,0,6,10,2,3,0,21,Mirage,Angel,I did not make a second attempt.,I did not make a second attempt.,First attempt,4,Early strikes kept the mastermind weak but he still got way stronger than I liked. Thanks to early clone I was able to recruit M's entire hero deck. I was playing a 3 cost spidey deck with karma and mirage supporting.,,,
,,7,(+4),32,Pervavita & Catswiftie,99,19,118,1st,Yes (6),9th,36 (2),1st,0 (6.5),1st,3.278 (10),24.5,,80,34,0,0,3,5,0,3,0,11,Wolfsbane,Jean Grey,Jean Grey,Wolfsbane,Second attempt,5,"Game one had a quick overrun from sinister clones making the MM unreachable coupled with no rare cards showing up.
Game two did much better, M/Wolfsbane hit Belasco turn 6 and could never replicate the big hit on him well Jean/Karma was able to clean house coming just shy of a triple MM hit one turn. The city was much easier to control.",,,
,,8,(+3),33,Pizza (.gaxim) & Extra Cheese (Rolf101),46,27,73,1st,Yes (6),8th,34 (3),1st,0 (6.5),8th,2.147 (3),18.5,,19,13,0,0,5,4,2,1,0,12,Jean Grey,Colossus,Colossus,Strong Guy,First attempt,4,Skin of our teeth. We sat at 4 heroes in zoo for so long. Green is the way to go. Regret strong guy. He was too expensive.,,,
,,9,(+2),31,DRobb & ShadowOfTheBat,25,37,62,1st,Yes (6),6th,30 (4.5),9th,2 (2),9th,2.067 (2),14.5,,12,5,0,0,4,6,2,2,0,14,Iceman,Sunspot,Iceman,Sunspot,Second attempt,3,Having the worst draws both game do not help with the fun level,,,
,,10,(+1),30,MysticRuby,16,30,46,10th,No (1),10th,32 (1),10th,3 (1),10th,1.438 (1),4,,14,3,0,1,1,7,0,2,0,11,Angel,"Uatu, The Watcher",I did not make a second attempt.,I did not make a second attempt.,First attempt,2,Schedule crunch + not sure how to compliment the heroes. Might have been able to do so with more time. Probably my worst week so far.,,,
48,Strategic Homeland Intervention,1,(+10),37,Sandals & Mrs Sandals,58,36,94,1st,Yes (5),4th,32 (5),3rd,1 (5),1st,2.938 (8),23,,22,3,17,1,2,4,3,0,0,10,Stature,Storm & Black Panther,Stature,Storm & Black Panther,Second attempt,5,"My wife always likes a set up that lets her get rid of starters - this time they were worth points too! She went heavily into Shield Level both times, once getting Mockingbird's ramping uncommon and once Coulson's. She did the majority of damage to Maria. I mostly kept the City clear.
Game 1 we lost on twist 7 which appeared on the turn my wife could have done the final blow. On game 2 we'd been able to delay til twist 8 but won before twist 7 anyway.
We had three unlucky escapes in our two games - one to a strike, one to an Ambush, one to a strike after her Fill The City tactic. Each time we'd cleared one spot but needed 2. Ah well, at least we won!
I love it when the Shield heroes get to work together. Just a shame that I couldn't also use Black Widow, Agent X13 or Rick Jones here for the full Shield team!",,,
,,2,(+9),35,CK,27,74,101,1st,Yes (5),6th,36 (3),1st,0 (7.5),2nd,2.806 (7),22.5,,47,1,16,1,1,0,1,2,0,5,Iceman,Speedball,Iceman,Speedball,Second attempt,5,"Fun setup. I finally got a chance to try Iceman... and he was terrible! First game I had a little luck with him, but Speedball's rare did more work than all of Iceman's cards. Second game I got super unlucky with twists, burying nearly all of Iceman's cards and leaving me with only 1 HQ space by turn 25. Mockingbird's uncommon completely carried that game.

Game 1 was 6 turns faster and a bit better on PPT, but with 2 escapes. Game 2 was slow with no escapes. I don't think either game was very good, but I went with game 2.",,,
,,3,(+8),35,Ocs333,35,34,69,1st,Yes (5),1st,26 (8),6th,2 (3),5th,2.654 (4),20,,1,2,8,2,3,6,4,0,0,15,Wolverine (X-Force),Bishop,Wolverine (X-Force),Bishop,First attempt,3,"Maria is a really frustrating mastermind. The whole setup really depended on the arrangement of the villain deck, and also the hero deck. 
I picked Bishop and Wolverine who could provide extra KO and card draw. In first game they turned out to be really good picks. Unfortunately by turn 10 I already had 2 (sort of inevitable) escapes, as I got unlocky with starting hands, strong villains, and early master strikes. Then Bishop KO and an influx of henchmen in midgame helped creating efficient decks, resulting in a relatively quick win against Maria. 
Second game went totally different. I got lucky with early henchmen, but HQ had very bad heroes (Quake recruit cards), while getting lot of master strikes and shield elites. So by midgame my hands got overcrowded by Officers. While there were some stong turns, the final master strike still filled the city, resulting in an escape. Got quite high shield level, however. So both game had around 2.6 VP/turn, but first game had 26 turns, 2 escape. Second game had 34 turns, 1 escape. We'll see wheter I made the good choice by submitting the first one.  I guess 1 escape will be common, but also the 8 turn difference can mean a lot. ",,,
,,4,(+7),33,jpilger,66,42,108,1st,Yes (5),7th,40 (2),1st,0 (7.5),4th,2.7 (5),19.5,,24,4,18,0,1,0,0,0,0,1,Ghost Rider,Punisher,Ghost Rider,Punisher,Second attempt,5,"A nail-biter down to the last card in the villain deck.  I won quicker my first game, but with a lot of escaped villains and not nearly as many undercover points.  I really liked playing all the SHIELD heroes together.  Fun setup and very thematic.  I chose Ghost Rider and Punisher from Dark City because Ghost Rider was in a season of Agents of Shield, and Punisher just fit better thematically than the other MK heroes from Dark City.",,,
,,5,(+6),32,AntDude & WaspWoman & PowerPupa,58,21,79,1st,Yes (5),2nd,29 (7),7th,3 (1.5),3rd,2.724 (6),19.5,,37,1,10,2,2,3,3,2,0,12,Iceman,Tigra,Iceman,Tigra,First attempt,4,"So much SHIELD! This one escalated quickly and I had some early escapes, but things settled in nicely once SHIELD levels hit their targets. Headlok and Battle Staves delivered their extra cards, and Iceman and Quake had some nice range synergy. Iceman's rare was the story in the game as it allowed for enough attack to clear SHIELD villains from the city and allow for double SHIELD clearance for the Maria hit. Whole family's been super busy, so these games were all AntDude.",,,
,,6,(+5),31,dontfeedthegreen,38,36,74,1st,Yes (5),3rd,30 (6),3rd,1 (5),7th,2.467 (2),18,,2,1,5,1,1,2,6,1,0,11,Bishop,Forge,Bishop,Ant-Man (Ant-Man),First attempt,4,"Tough match. Had a decent game 1 with Forge, despite losing BFG to the Scheme. Switched to Ant-Man for game 2, which I think was better, despite being diluted by the HQ, but I just got a tougher shuffle and couldn’t get any of the KO/Undercover combos going early enough, so that game ended slower with more escapes, and annoyingly with substantially more VP. Still, I’ll trade that for doing better on speed and escapes and submit match 1.",,,
,,7,(+4),30,jdub,35,48,83,1st,Yes (5),5th,34 (4),3rd,1 (5),8th,2.441 (1),15,,13,2,8,0,1,2,2,1,0,6,Jocasta,Forge,Jocasta,Forge,First attempt,3,"I enjoyed this game but I felt it got a little repetitive. The interaction between all the Shield characters was a lot of fun. Jocasta fit in really nice, I do wish I had seen some more of Forges cards but that is what happens. This was a hard decision for me to decide which game to take. One had less turns but more villains escape and less overall points earned but a higher points per turn average. While the other one had less villains escape and a few more turns.",,,
,,8,(+3),30,Buya & DSCern,39,31,70,8th,No (1),8th,28 (1),7th,3 (1.5),6th,2.5 (3),6.5,,8,2,17,2,1,6,4,0,0,13,Stature,Ant-Man (Ant-Man),Stature,Ant-Man (Ant-Man),Second attempt,4,"A challenging setup that we had trouble with, mainly with the Villain escapes leading to spots in the HQ getting destroyed. We figured we could only have 1 escape to survive until the 8th twist in this setup, but Maria and her officers were intent on getting out of the city. Ugh she's a frustrating Mastermind. If we could've gotten to 1 more Twist I think we would've pulled out a Victory, but that was not in the cards for us this time.",,,
,,9,(+2),29,energythief,-,-,-,-,-,-,-,-,-,-,-,-,-,-,-,-,-,-,-,-,-,-,-,-,-,-,-,-,-,-,,,
,,10,(+1),27,Jinjoz,-,-,-,-,-,-,-,-,-,-,-,-,-,-,-,-,-,-,-,-,-,-,-,-,-,-,-,-,-,-,,,
49,"Striker, No Striking!",1,(+10),35,Tozar,20,19,39,1st,Yes (4.5),1st,13 (8),1st,0 (4.5),1st,3 (8),25,,1,1,0,4,5,14,5,0,0,28,"Peter Parker, Homecoming",White Wolf,"Peter Parker, Homecoming",White Wolf,Second attempt,5,"Hitting Adrian Toomes as much as possible before getting Master Strikes, made both of my games fast.  Maximizing usage of Danger Sense helped keep the Master Strikes in the Villain Deck.  I chose the faster of my two games at the expense of a bit of ppt.  We'll see if it pays off or not.",,,
,,2,(+9),34,Narellish & oskar,32,44,76,1st,Yes (4.5),5th,26 (4),1st,0 (4.5),2nd,2.923 (7),20,,12,4,0,1,3,7,4,0,0,15,Brainstorm,Fantastic Four United,Brainstorm,Fantastic Four United,First attempt,5,"For us the hero choice was a difficult one this week. No obvious standouts but a few which might have worked out. We ended up going with Fantastic Four United for the focus strategy and Brainstorm to pair with Princess Shuri. We were hoping to play a real fast and furious game to prevent having too many masterminds, but the hero deck was not in our favour. Princess Shuri hid in the deck for both our games. So did the rares for our first game - which was our best. We were surprised how much we ended up using Happy Hogan - especially for his Co-ordinate. This tournament is great for being given heroes which we haven't used much before or for a few years. We loved how you paired the villains to the mastermind to make it extra challenging. After our first game we were a bit more disappointed that we hadn't won quicker but then our second game took us 5 turns longer so we are hoping 26 turns wasn't as slow as it felt.",,,
,,3,(+8),33,PragmaticSquid,30,41,71,1st,Yes (4.5),4th,25 (5),1st,0 (4.5),3rd,2.84 (6),20,,11,4,0,2,5,7,1,1,0,16,Fantastic Four United,"Killmonger, Spec Ops",Fantastic Four United,"Killmonger, Spec Ops",Second attempt,5,"What a great excuse to break out more Homecoming - don't often play that set and it took me a full game to game the solo mechanics of coordinate.  Great time using Happy and Psi-Lord to go scheme hunting.  With the ascending masterminds, really added the jeopardy!",,,
,,4,(+7),32,KelgatesKollections,25,39,64,1st,Yes (4.5),3rd,24 (6),1st,0 (4.5),6th,2.667 (3),18,,14,2,0,2,4,6,4,1,0,17,Peter's Allies,Brainstorm,Peter's Allies,Brainstorm,First attempt,4,"Ironically enough, I haven't played a lot of Homecoming as of late as I ain't too fussy about the MCU art on the cards. However, since Toomes is only 5 attack early on. I wanted to try and beat him up as much as possible with Michelle's powerful ability of fighting the Mastermind with recruit. This allowed me to fight him twice in one go early on before he got out of hand. 

From there, it was just trying to clean up the ascended Masterminds to get the win at a respectively 24 turns. I'm not sure if Brainstorm was the right pick for the other hand, as I went with a tech and range synergy that felt like it was constantly going out of time but not sure if it technically did anything but durdle around too much haha. I suspect 24 is good, but could be a middle of the pack in terms of turn orders unless those Master Strikes come out early!",,,
,,5,(+6),30,Flipflopmaniac,24,55,79,1st,Yes (4.5),6th,28 (3),1st,0 (4.5),4th,2.821 (5),17,,31,0,0,1,4,3,2,2,0,12,"Peter Parker, Homecoming",White Wolf,"Peter Parker, Homecoming",White Wolf,First attempt,4,"I really liked this setup, the only thing that was a rough spot for me was facing the Giants again because of their type of disruption.  I tried to lean into the Danger Sense so that I wouldn't get overrun by Masterminds so Holland fit with Happy and Psi-Lord; Shuri and White Wolf paired up for Tech and Ambush triggers.  Turned out one side went almost full Instinct and Danger Sense'd to a clean city and smooth win, only hiccup was three quick Strikes near the beginning so I didn't get any cheap hits on Adrian.",,,
,,6,(+5),30,Gambit.n.rogue,23,33,56,1st,Yes (4.5),2nd,22 (7),1st,0 (4.5),8th,2.545 (1),17,,10,1,0,2,4,9,3,2,0,20,"Uatu, The Watcher",General Okoye,"Uatu, The Watcher",General Okoye,Second attempt,5,Lots of strategy involved when deciding when to fight the mastermind or get victory points. Happy Hogan was good and bad depending on when those master strikes came out! Fun!,,,
,,7,(+4),29,Cglied,36,57,93,1st,Yes (4.5),7th,34 (2),1st,0 (4.5),5th,2.735 (4),15,,21,4,0,0,4,1,1,1,0,7,King Black Panther,White Wolf,King Black Panther,White Wolf,Second attempt,4,"Usually if I play through a setup twice, I end up with two vastly different games. Not the case with this one. Both #1 and #2 were the almost the exact same. Same # of turns, within a few VP of each other, heck even the hands looked kind of identical. A bunch of early master strikes didn't too much to ding my hands too badly, but it made tougher to get the necessary attack to hit the mastermind, which added to my turn count for sure.",,,
,,8,(+3),28,Mikeygill97,50,49,99,1st,Yes (4.5),8th,38 (1),1st,0 (4.5),7th,2.605 (2),12,,1,4,0,0,1,1,0,0,0,2,Brainstorm,Peter's Allies,Brainstorm,Peter's Allies,First attempt,4,Good thing it wasn't Epic.,,,
,,9,(+2),27,AdamantiumGambit,-,-,-,-,-,-,-,-,-,-,-,-,-,-,-,-,-,-,-,-,-,-,-,-,-,-,-,-,-,-,,,
,,10,(+1),25,ItStartsWith1,-,-,-,-,-,-,-,-,-,-,-,-,-,-,-,-,-,-,-,-,-,-,-,-,-,-,-,-,-,-,,,
,,11,,,,,,,,,,,,,,,,,,,,,,,,,,,,,,,,,,,,
50,The Daily Planet,1,(+10),37,Swagolas,32,76,108,1st,Yes (5.5),5th,29 (6),1st,0 (5.5),1st,3.724 (10),27,,44,2,8,0,2,1,4,0,0,7,Bruce Banner,Hulkbuster Iron Man,Bruce Banner,Hulkbuster Iron Man,First attempt,4,"Had to play my games pretty quickly on day 1 because I am going for a vacation for a week. I was pretty satisfied with my hero choices, they played pretty great together. I was a little worried that I won't be able to make use of the shield levels with just Mockingbird, but I got the rare and a few of her other cards and that seemed to be useful enough. Bruce's and Hulkbuster's 2 costs made me draw a bunch of extra cards. Also the scheme seemed to help more than hurt me with the villains with Last stand. My strategy was to fill up the city with weaker villains not to give a chance for the Last stand effects to get ouf of hand, that way I was able to defeat them without any problem really. When the city and the VD felt comfortable enough, I was able to defeat the weaker villains and henchmen in the city to make it empty and finish the MM. Fun game, can't wait to see the results of my pod mates!",,,
,,2,(+9),36,david-h11,30,65,95,1st,Yes (5.5),2nd,27 (9),1st,0 (5.5),4th,3.519 (7),27,,35,2,10,1,1,5,3,1,0,11,Deathlok,Hellcat,Deathlok,Hellcat,First attempt,4,"First game was fun, had an instinct deck that was really powerful by the end but the second game was one of the craziest I've ever played. So many turns with massive attack but not being able to hit the mastermind because of enemies in the city. Had to fight a 18 attack Headman Char because he turned up when I had two big victory piles. Also managed to have 4/5 rares on one team and it was right down to the final turn. A lot of fun but not as good as the first attempt haha. Skaar felt out of place, could have done more to work with him but the other heroes worked together surprisingly well",,,
,,3,(+8),37,Bikk Bikk,61,18,79,1st,Yes (5.5),1st,25 (10),1st,0 (5.5),6th,3.16 (5),26,,43,3,4,1,3,7,1,0,0,12,Hulkbuster Iron Man,Darkhawk,I did not make a second attempt.,I did not make a second attempt.,First attempt,4,Darkhawk paired so well with Hulkbuster Iron man.,,,
,,4,(+7),31,Astigmatic_oracle,56,40,96,1st,Yes (5.5),3rd,28 (7.5),1st,0 (5.5),5th,3.429 (6),24.5,,16,2,8,0,4,4,2,0,0,10,Darkhawk,Gladiator Hulk,I did not make a second attempt.,I did not make a second attempt.,First attempt,4,Probably the most fun game I've played against the Red King. Smash + Hyperspeed is a fun combo. I decided to support Speed with my hero choices instead of going with support for Mockingbird and it paid off.,,,
,,5,(+6),32,Handballermann & Efruhuhn,48,68,116,1st,Yes (5.5),7th,32 (3.5),1st,0 (5.5),3rd,3.625 (8),22.5,,20,1,18,0,1,1,1,1,0,4,Deathlok,Agent Phil Coulson,Deathlok,Agent Phil Coulson,First attempt,3,"We tried to hard focus on Shield Level, but our card draw failed us in both games. Nothing worked out as we planned. Feasted our good cards away, bad luck drawing cards. As soon we got the legendary cards, it became nice and fast.",,,
,,6,(+5),35,GamerGump & Kendycrow,39,82,121,1st,Yes (5.5),9th,33 (2),1st,0 (5.5),2nd,3.667 (9),22,,43,2,16,0,0,0,0,0,0,0,War Machine,Quake,Darkhawk,Quake,First attempt,4,"The combination of Dark Avengers with Last Stand and The Red King not being able to be attacked while Villans are in the city was a tough combo. Lots of KOing of cards was nice, by the last few turns we were rolling and barley scrapped out a win on literally last possible turn.",,,
,,7,(+4),32,waxbottle & Mrs. waxbottle,35,51,86,1st,Yes (5.5),3rd,28 (7.5),1st,0 (5.5),8th,3.071 (3),21.5,,16,2,4,1,2,5,0,0,0,8,Bruce Banner,Rick Jones,I did not make a second attempt.,I did not make a second attempt.,First attempt,4,Last Stand villains in the HQ were tricky!  Fun stuff!  Mockingbird + Rick Jones was great.,,,
,,8,(+3),34,Pokeloly,53,43,96,1st,Yes (5.5),6th,31 (5),1st,0 (5.5),7th,3.097 (4),20,,10,2,15,1,0,1,2,0,0,4,Korg,Deathlok,Korg,Deathlok,First attempt,3,Went with Korg since I figured his rare might be able to get some large attack values from the villains in the HQ. I managed to buy him but it only really got one decent turn though it did help in clearing the villains from the HQ.,,,
,,9,(+2),26,eventhorizon0121,34,59,93,1st,Yes (5.5),7th,32 (3.5),1st,0 (5.5),9th,2.906 (2),16.5,,25,2,10,1,0,3,0,0,0,4,Gladiator Hulk,She-Hulk,Gladiator Hulk,She-Hulk,First attempt,4,"This setup felt like slogging through mud. The HQ got bogged down the first attempt and then the second attempt saw a ton of wounds in the first 10 turns. Both games ended in a similar number of turns. I chose the first, where Mockingbird scaling carried the day against the Red King while a Skaar/Gladiator Hulk deck played Street Sweeper. The second had less defined deck development but more balance.",,,
,,10,(+1),26,wingedcrusader,58,37,95,1st,Yes (5.5),10th,35 (1),1st,0 (5.5),10th,2.714 (1),13,,21,2,1,0,1,0,0,0,0,1,Gladiator Hulk,"Miek, the Unhived",I did not make a second attempt.,I did not make a second attempt.,First attempt,3,"It was weird and challenging but interesting, I definitely don't like wounded fury or Skaar very much but I like the combination of the scheme and last stand, felt very interesting.",,,
,,11,,,,,,,,,,,,,,,,,,,,,,,,,,,,,,,,,,,,
51,An Apple A Day Keeps Avengers Away,1,(+10),33,Tuba2k7 & Alicat22,81,38,119,1st,Yes (7.5),2nd,31 (9),1st,0 (6.5),1st,3.839 (10),33,,43,23,16,0,4,0,3,0,0,7,Ghost Rider 2099,Ultron,I did not make a second attempt.,I did not make a second attempt.,First attempt,4,piplup1112111 played this setup,,,
,,2,(+9),32,evilspacecow,35,59,94,1st,Yes (7.5),1st,30 (10),1st,0 (6.5),6th,3.133 (5),29,,24,10,8,2,2,4,2,0,0,10,Kraven the Hunter,Ghost Rider 2099,Kraven the Hunter,Ghost Rider 2099,First attempt,2,"Don't really like the villain game and the Uru Weapons, while made for some Villain deck control were annoying.",,,
