,,11,,,,,,,,,,,,,,,,,,,,,,,,,,,,,,,,,,,,
56,Glorious Porpoise,1,(+11),26,owen_meany,22,40,62,1st,Yes (6.5),1st,21 (11),1st,0 (8),2nd,2.952 (10),35.5,,18,3,0,2,6,7,5,1,0,21,Mr. Fantastic,Cyclops,Mr. Fantastic,Cyclops,First attempt,3,"Fast game and stress free game. Was great to combine Deadpool and Wolverine as they worked well together, as it they should (shouldn't?).",,,
,,2,(+10),25,caseystahl1125,53,31,84,1st,Yes (6.5),5th,28 (7),1st,0 (8),1st,3 (11),32.5,,22,12,0,2,5,5,2,0,0,14,Black Widow (Avengers),Rogue,Black Widow (Avengers),Rogue,First attempt,1,I was jealous of other setups in the other pods. Love is Blind in my pods.,,,
,,3,(+9),26,Babybreloom,47,26,73,1st,Yes (6.5),4th,27 (8),1st,0 (8),4th,2.704 (8),30.5,,21,9,0,1,3,8,3,0,0,15,Human Torch,Invisible Woman,Human Torch,Invisible Woman,First attempt,3,The game was pretty straight forward. Played 2 rounds and they came out almost identical.  Hard a hard time getting things going early on with the wounds accumulating.,,,
,,4,(+8),15,jgoodnough and daughter,36,27,63,1st,Yes (6.5),2nd,24 (10),1st,0 (8),6th,2.625 (6),30.5,,9,0,0,2,2,6,5,2,0,17,Mr. Fantastic,Rogue,I did not make a second attempt.,I did not make a second attempt.,First attempt,4,lot of fun,,,
,,5,(+7),23,thablackknight1,58,14,72,1st,Yes (6.5),3rd,25 (9),8th,1 (3.5),3rd,2.88 (9),28,,44,7,0,3,4,6,4,0,0,17,Silver Surfer,Hulk,I did not make a second attempt.,I did not make a second attempt.,First attempt,2,Felt bland compared to the other pods played thus far.,,,
,,6,(+6),14,Freeclint,66,39,105,1st,Yes (6.5),10th,39 (2),1st,0 (8),5th,2.692 (7),23.5,,27,4,0,0,1,1,0,0,0,2,Captain America,Hawkeye,I did not make a second attempt.,I did not make a second attempt.,First attempt,4,Good fun.  Wish I wasn't rushed to do it and had time for attempt two.,,,
,,7,(+5),28,Minos_griffin & Phryne,26,56,82,1st,Yes (6.5),8th,32 (4),1st,0 (8),7th,2.563 (5),23.5,,30,8,0,1,2,3,3,0,0,9,Thor (Avengers),Human Torch,Thor (Avengers),Human Torch,First attempt,1,Not only core is not fun anymore to play and I understand that it is difficult to set up games where everyone could have similar sets but it is not enjoyable to be sent to the bottom of the groups when you are doing good. Really difficult to enjoy the tournament when that happens.,,,
,,8,(+4),24,sword'n'sorcery,28,64,92,1st,Yes (6.5),9th,36 (3),1st,0 (8),8th,2.556 (4),21.5,,36,10,0,0,0,4,0,0,0,4,Human Torch,Hulk,Human Torch,Black Widow (Avengers),First attempt,2,"I really struggled to refine my decks in both games. The Villain deck/Mastermind was very unforgiving with lots of wounds with barely any opportunities to KO cards. I went Human Torch and Hulk in game 1 to focus on accumulating and KO'ing wounds, but I found that my deck just got clogged with SHIELD cards (when I hit the Loki tactic to KO 4 cards, my discard pile was empty). I swapped out Hulk for Black Widow in game 2, and that went a lot better. Unfortunately, some bad timing with Scheme Twists meant that I wasn't able to recruit many of her best cards to set up my decks well. My final score for both games was very very close. I was a bit faster in game 2, but defeated some higher value villains in game 1. I decided to report game 1 just because I had two villains escape in game 2. 
If I could try this a third time, I might try Invisible Woman and Black Widow to really double-down on the KO ability. Though that build may have struggled with attack value? I might try it just for the heck of it.
This game was a classic example of ""I have great cards in my decks, if only I could draw them more often."" One turn Player 2 had 17 attack, then the next round they drew 4 shield agents and 2 troopers...",,,
,,9,(+3),13,ReyReyPod,47,25,72,1st,Yes (6.5),7th,31 (5),10th,3 (2),9th,2.323 (3),16.5,,22,6,0,1,3,4,2,0,0,10,Hulk,Silver Surfer,I did not make a second attempt.,I did not make a second attempt.,First attempt,5,I love the core heroes,,,
,,10,(+2),17,Ironclad4521,36,24,60,1st,Yes (6.5),6th,29 (6),11th,4 (1),10th,2.069 (2),15.5,,12,11,0,4,2,5,2,0,0,13,Black Widow (Avengers),Mr. Fantastic,I did not make a second attempt.,I did not make a second attempt.,First attempt,3,Heralds of Galactus are a nightmare when they come out early which must be why they have more VPs than Loki as MM. Fortunately MS stayed lownin the deck so wounds weren't really a problem. Black Widow and Deadpool played nice on one hand and Thing / Wolverine were good too. My tweener Mr Fantastic helped a bit with Things activation but not much else. I keep low scoring though... More to learn.,,,
,,11,(+1),15,SharkNate-O & onthegeniusofsamrockwell,42,38,80,11th,No (1),11th,41 (1),8th,1 (3.5),11th,1.951 (1),6.5,,4,4,0,0,0,0,0,0,0,0,Hulk,Human Torch,Hulk,Human Torch,First attempt,1,"I actually feel embarrassed to even submit these results for our game lol. However, despite our embarrassing loss, the format was just incredibly boring for both of us.",,,