Pod,Setup,Rank,Name(s),"Victory
Pile 1","Victory
Pile 2","Total
VP",Win?,,Turns,,Escaped Villains,,Points per Turn,,Total Rank Points,,VP Difference,Bystanders Rescued,"Hero Choice 1
(Attempt 1)","Hero Choice 2
(Attempt 1)","Hero Choice 1
(Attempt 2)","Hero Choice 2
(Attempt 2)",Attempt Submitted,,Fun Level,Comments
,,,,,,,Rank,Points,Rank,Points,Rank,Points,Rank,Points,,,,,,,,,,,,
1,Mole Man's Invincible Force Field,1,pspblink,28,23,51,1st,Yes (6.5),1st,18 (10),1st,1 (9.5),3rd,2.833 (8),34,,5,3,Hulk,Rogue,Hulk,Rogue,Second attempt,3,3/5,Recruited heavy hitters early was key.
,,2,Sparky001,61,38,99,1st,Yes (6.5),4th,22 (6),1st,1 (9.5),1st,4.5 (10),32,,23,20,Hawkeye,Hulk,Hawkeye,Hulk,First attempt,4,4/5,"Game 1 went a lot better then game 2 point wise, used Hawkeye to give a boost to Wolverine and Spider-Man’s abilities with the latter gaining the bystanders and the former taking out the city villains.
 While hand 2 focused on a Hulk and Thing mostly green deck used to deal the damage to Mole Man to good effect, found it to be an interesting set up and look forward to the rest of the tournament."
,,3,Mangostrike,32,27,59,1st,Yes (6.5),2nd,21 (8.5),3rd,2 (7.5),5th,2.81 (6),28.5,,5,10,Hulk,Rogue,Hulk,Rogue,First attempt,4,4/5,First game I was able to KO quickly and then get a Hulk/Wolverine engine going with Thing’s rare and Hulk’s rare in the mix. Second game was a major fail with the HQ clogged with 5 recruit heroes and no ability to KO or do damage.
,,4,JesterJeeto,27,35,62,1st,Yes (6.5),4th,22 (6),5th,3 (3.5),4th,2.818 (7),23,,8,5,Emma Frost,Thor (Avengers),Nick Fury,Mr. Fantastic,First attempt,4,4/5,This one can get away from you quick with the stacking forcefields and escaped subterranean villains. Thank goodness Wolverine was in the pool. LOL
,,5,Yeeches,36,46,82,1st,Yes (6.5),8th,25 (3),5th,3 (3.5),2nd,3.28 (9),22,,10,15,Gambit,Silver Surfer,Gambit,Silver Surfer,First attempt,5,5/5,Went for a focus deck on one side which did really well with Surfer and Thing's rares. Spidey and the X-Men did better than I expected with strong draw power. A few early escapes definitely hurt me but I totally lost in the rematch! Kind of a deceptively tough setup in the late game. A very fun set up that felt well balanced ( I love burrow so much).
,,6,kata124,23,21,44,1st,Yes (6.5),2nd,21 (8.5),5th,3 (3.5),8th,2.095 (3),21.5,,2,2,Human Torch,Mr. Fantastic,Human Torch,Mr. Fantastic,Second attempt,4,4/5,Fun! Felt good about my choices.
,,7,ItStartsWith1,19,42,61,1st,Yes (6.5),4th,22 (6),5th,3 (3.5),6th,2.773 (5),21,,23,5,Invisible Woman,Rogue,Invisible Woman,Rogue,Second attempt,4,4/5,"First game was so lucky and unlucky at the same time. I lost on timer on turn 21, despite buying 3 rares! Barely halfway through the Villain deck! Second was payback, with the right side double copying Berserker Rage on back to back turns to finish Moleman. Left side was a Thing recruit deck that held it down until the Wolvie and Rogue took off and finished it. Bummed by the 3 escapes, so tried to finish as quickly as possible."
,,8,jpilger,42,20,62,1st,Yes (6.5),7th,23 (4),5th,3 (3.5),7th,2.696 (4),18,,22,6,Human Torch,Nick Fury,Human Torch,Nick Fury,Second attempt,4,4/5,"Really want to rate the setup a 5, but want to see if other setups are as good or better.  I've been playing a lot of solo games, and gloomhaven has been my recent effort.  And it has been an effort.  It was awesome to get Legendary back on the table and be able to respond to the clarity of the deck-building mechanics.  Thanks for putting this league together."
,,9,freeclint & gnomemaster,24,22,46,9th,No (1.5),10th,29 (1),3rd,2 (7.5),10th,1.586 (1),11,,2,9,Human Torch,Gambit,Mr. Fantastic,Invisible Woman,First attempt,4,4/5,We got wrecked!  Mole man has never been this tough!
,,10,jgoodnough,23,30,53,9th,No (1.5),9th,33 (2),5th,3 (3.5),9th,1.606 (2),9,,7,11,Hulk,Invisible Woman,Human Torch,Storm,First attempt,1,1/5,it was tough hitting Mole Man since he got extra hits from the escaped Subterra villains AND the Twists
2,Dormammu Shoots Hulk into Space,1,OllieKitKat & Kylah15,19,91,110,1st,Yes (5.5),1st,19 (9.5),1st,0 (7.5),1st,5.789 (10),32.5,,72,41,Amadeus Cho,Siryn,Amadeus Cho,M,Second attempt,4,4/5,"We tossed around a few ideas for how to approach this, yondu / Adam warlock for some shard stuff.  Amadeus for some tech support for the scheme.  We ultimately went with Amadeus and M and it worked pretty well.  Lots of bystanders due to the celestials helping us rescue bystanders when we'd fight a villain.  Cloning was super helpful a few times to give us some extra heroes. Overall it was a lot of fun."
,,2,Redblock,63,28,91,1st,Yes (5.5),1st,19 (9.5),1st,0 (7.5),2nd,4.789 (9),31.5,,35,9,M,Warpath,M,Warpath,First attempt,5,5/5,"One hand went cloning madness with M+ cucoos, other tried to go bystander combo with Hiroim and Ronan. With so much cards of same type gained from cloning Celestials became pushovers. Hand 1 had 43 cards total in deck after game ended."
,,3,Jalt,45,44,89,1st,Yes (5.5),5th,27 (5.5),1st,0 (7.5),4th,3.296 (7),25.5,,1,19,Rictor,The Vishanti,Rictor,The Vishanti,First attempt,5,5/5,"After 5 scheme twists in a row to start this, I was certain attempt 1 was going to be a bust. All plans went out the window as I was scrambling to recruit Hulkbuster to prevent the loss. I ended up with a Hulkbuster and Ronan hand with Rictor for KO power that started setting me up to hit the MM almost every turn. My wife was building up bystanders with Hiroim and was taking all of the Demonic Bargains with Vishanti for a fun and quick game."
,,4,Dre 2 point 0,60,30,90,1st,Yes (5.5),4th,26 (7),9th,2 (2),3rd,3.462 (8),22.5,,30,17,Bruce Banner (World War Hulk),Caiera,Bruce Banner (World War Hulk),Caiera,Second attempt,4,4/5,It truly all comes down to the shuffle. I kept the same hero choices and the 2nd attempt had way more momentum with early recruiting and transforming of heroes. Double boons from Nezarr made a huge difference too.
,,5,Mr. Omnishambles,43,26,69,1st,Yes (5.5),3rd,24 (8),7th,1 (3.5),6th,2.875 (5),22,,17,11,Korg,The Vishanti,Korg,Amadeus Cho,Second attempt,2,2/5,"I don't like this Scheme very much. Very swingy with the early loss by twist #7. This happened in my first match, when I only needed the Final Blow in my 23rd turn! I had zero escapes at that the point and 22 rescued bystanders - would have been a great score.... ah well.....For the second try I substituted one of my chosen heroes and this worked fine. But I couldn't prevent one escape due to the masses of Sinister Clones at the beginning of my match."
,,6,illmatic,35,47,82,1st,Yes (5.5),7th,30 (3.5),1st,0 (7.5),7th,2.733 (4),20.5,,12,18,M,Captain Mar-Vell,M,Rictor,Second attempt,4,4/5,"Resubmitting as I noticed other left more in-depth comments, and I'd like to as well.  Clone sets (M + Stepford) didn't provide great recruit towards non-Clone heroes, and they can make for some really large decks due to having no KO abilities.  However, they can build up more attack early in the game than non-cloning cards due to their frequency + Tactical Formation, and they handled the Celestials well due to duplicate classes.  That allowed me to keep the city clear while I waited on Hiroim's transform card to get OP with bystander count (thank you Sinister Clones).  Pretty good set-up, I got hurt in Game 1 by not buying prison ship recruits early enough, and when Hulkbuster's 8-point card came up late, it blocked my ability to manage the count on the ship."
,,7,CaptainMetroidica,35,41,76,1st,Yes (5.5),7th,30 (3.5),1st,0 (7.5),8th,2.533 (3),19.5,,6,15,Korg,M,I did not play a second attempt.,I did not play a second attempt.,First attempt,5,5/5,"The Celestials were in the set up, and they are my absolute favorite villain group so that was a real treat! I got the one that reduces mastermind threat by 1/5th, Nezarr, on the third turn. That was the only thing that let me get ahead as fast as I did. Left side had 3 Celestials downed and the right had 1. Really let me do some churning and rescuing more bystanders. The Lords of Netherworld didn't really throw too much of a roadblock for me. The cloning worked really well in my favor, and is bringing me around on liking the mechanic more. Overall, great set up! Only had time for one play so hopefully it does well!"
,,8,Mikeygill97,40,38,78,1st,Yes (5.5),9th,31 (2),1st,0 (7.5),9th,2.516 (2),17,,2,11,M,Doctor Voodoo,M,Doctor Voodoo,First attempt,4,4/5,Decided to go with M because of her 3 abilities and Dr. Voodoo for some flavor for some Artifact possibilities but it didn't happen as much as I had hoped. Overall still a fun game.
,,9,Bronson,56,45,101,1st,Yes (5.5),10th,32 (1),7th,1 (3.5),5th,3.156 (6),16,,11,22,Bruce Banner (World War Hulk),Gladiator Hulk,Bruce Banner (World War Hulk),Gladiator Hulk,Second attempt,2,2/5,"Double cloning the Cuckoos was fun, but otherwise just had a hard time ever feeling great about our decks. If Dormammu had a higher strength feel like we would have been toast. We got a good thing going on one hand with Gammenon's bystander mechanic fly-wheeling with Ronan's 4-cost. Hindsight on deck building might have leaned stronger in bystander mechanics for the 2 free-agents."
,,10,Swagolas,48,17,65,1st,Yes (5.5),5th,27 (5.5),10th,4 (1),10th,2.407 (1),13,,31,1,Phyla-Vell,Quasar,I did not play a second attempt.,I did not play a second attempt.,First attempt,4,4/5,"On turn 5 I already had 8 Mr. Sinister Henchmen enter the city, that’s how I got the 4 escapes.
The setup in theory was bystander-based, but I couldn’t really make a use from the effects.
Pretty much the whole game I got so lucky with my hand 1 draws, so half way to the game I decided to just boost up my hand 1 as much as possible even with hand 2’s plays. I was able to hit Dormammu 3x on my last turn! (2 transforms for Hulkbuster Iron Man, a bunch of card draws, shards and burn-a-shard effects from Quasar…)"
3,Arnim Zola Provokes a Clash of Nations,1,Drewfusmcge,23,25,48,1st,Yes (6),1st,21 (10),1st,0 (7.5),2nd,2.286 (9),32.5,,2,1,Gamora,Star-Lord,I did not play a second attempt.,I did not play a second attempt.,First attempt,5,5/5,"Wowwwww. King BP and White Wolf on one side, Star-Lord and Angel Noir on the other. Only saw one Gamora card the whole time, but it didn't matter. I got an early Mind Stone which gave me enough recruit to get both King BP and White Wolf's rares. Never once had a master strike to mess up my HQ and eventually got Zola down to only 6 attack. My other side had three Star-Lord's Element Guns generating shards so it was a quick one. Lots of fun!"
,,2,dontfeedthegreen,30,35,65,1st,Yes (6),3rd,28 (8),1st,0 (7.5),1st,2.321 (10),31.5,,5,2,Star-Lord,Drax the Destroyer,Star-Lord,Daredevil Noir,Second attempt,2,2/5,"Zola can be frustrating, especially when King Black Panther’s rare shows up in the HQ. The Infinity Gems are a pain too, especially in tournaments where you’re having to hit high VP Villains for little to no VP benefit. I actually think Drax was the better Hero choice but my game with him got railroaded by an unbroken March of Infinity Gems leading to an escape at the start of the game. Daredevil Noir got a better shuffle and managed more VP in less time with zero escapes, so I went with that one!"
,,3,RemingtonChase,34,38,72,1st,Yes (6),4th,32 (7),1st,0 (7.5),3rd,2.25 (8),28.5,,4,2,Princess Shuri,Iron Man Noir,Princess Shuri,Iron Man Noir,Second attempt,4,4/5,"Enjoyable combo. Brought in Iron Man Noir and Shuri to emphasize tech strats (though Shuri didn't show up as early as I would've liked). I was able to build strong decks and keep things confidently under control, but due to a non-ideal HQ things lasted longer than I would've liked."
,,4,ChuckBau3r,25,33,58,1st,Yes (6),2nd,27 (9),7th,1 (3.5),4th,2.148 (7),25.5,,8,2,Gamora,Star-Lord,Gamora,Star-Lord,Second attempt,5,5/5,"Brought Gamora/Star-Lord to reduce the printed attack available to be in the HQ. Gamora was also highly supported with all the covert cards available in the randomized pool. Shards also made the scheme easier, as they provided attack that didn't get discarded on a twist. Just always kept a non-henchman villain available, and I never lost one scheme challenge!!"
,,5,caseystahl1125,31,31,62,1st,Yes (6),5th,33 (6),1st,0 (7.5),7th,1.879 (4),23.5,,0,1,Gamora,Star-Lord,I did not play a second attempt.,I did not play a second attempt.,First attempt,4,4/5,My strategy was to have all recruit in the HQ...Zola was approx. 14 hit points each turn for me becasue I had King Black Panther Rare and Angel Noir Rare that I couldn't recruit from HQ..made this scenario more difficult
,,6,D4Waterfall,36,30,66,1st,Yes (6),6th,35 (4.5),1st,0 (7.5),6th,1.886 (5),23,,6,6,Captain America (1941),Winter Soldier,Captain America (1941),Winter Soldier,First attempt,4,4/5,Heavy RNG on this one. First time through was about golden with getting 2 space gems to farm. Absolute trash on second attempt. Wasn't expecting it but had fun with Identical Twin Brother kicking out high scratches.
,,7,arnolamme,50,21,71,1st,Yes (6),6th,35 (4.5),9th,2 (2),5th,2.029 (6),18.5,,29,1,Daredevil Noir,General Okoye,I did not play a second attempt.,I did not play a second attempt.,First attempt,3,3/5,Angel Noir was a nice counter to Zemo's Ultimate Abomination
,,8,JParnell,18,42,60,1st,Yes (6),9th,39 (2),1st,0 (7.5),9th,1.538 (2),17.5,,24,2,Captain America (1941),Winter Soldier,Captain America (1941),Winter Soldier,Second attempt,3,3/5,"Game 1 was a disaster, with 2 rares starting in the HQ, and seeing 4 the whole game making Zola impossible. 

Game 2 leaned on my picks of Cap '41 and Bucky *hard* with the other deck doing it's best to lower abomination. After making it through 5 of the 8 first Twists, I was dead when the final one showed up, but it thankfully stopped at 10 long enough for me to Man Out Of Time the crap out of Zola."
,,9,DRobb & ShadowOfTheBat,34,34,68,1st,Yes (6),8th,38 (3),7th,1 (3.5),8th,1.789 (3),15.5,,0,9,Princess Shuri,Spider-Man Noir,Daredevil Noir,General Okoye,First attempt,3,3/5,2nd Game was rough with all the early Twist
,,10,Montax30,7,8,15,10th,No (1),10th,24 (1),10th,4 (1),10th,0.625 (1),4,,1,5,General Okoye,Princess Shuri,General Okoye,Princess Shuri,Second attempt,2,2/5,I hate this scheme lol
4,Mandarin's Secret Empire of Betrayal,1,Jean-Sebastien & Genevieve,68,33,101,1st,Yes (6),6th,30 (5.5),1st,0 (8),1st,3.367 (11),30.5,,35,14,Human Torch,Mockingbird,Human Torch,Mockingbird,First attempt,4,4/5,"Valkyrie had not much synergy with the 2 other heroes, but her thrown artifact was useful and we recruited multiple copies each games. All their other cards were never recruited."
,,2,Ceej,24,56,80,1st,Yes (6),4th,28 (8),1st,0 (8),4th,2.857 (8),30,,32,4,Quake,Mockingbird,Quake,Mockingbird,Second attempt,4,4/5,"Pretty easy setup overall. The difficulty will pretty much come down to how quickly the Mandarin's Rings come out vs. how quickly the Scheme Twists come out. In both my games I only ever saw 4 Rings, which wasn't great, and in both games the Twists seemed to be largely in the top half of the deck, which wasn't great either. I also got all 5 Master Strikes early both games. Still, the City was never even close to filling, and I had a number of turns with it completely empty.

My decks were mostly a little slow to get set up, which resulted in the game taking longer than it should have (my first attempt went to 36 turns, second 28). I picked characters with lots of Undercover abilities to crank up my SHIELD Level, and that mostly worked - both players in both games got up to at least level 7. I didn't have quite as many cards as I wanted that really needed it that high though; maybe I should've picked Coulson instead of Quake. I did manage to get at least three 24+ damage turns in the second game which was fun, and fired off Quake's rare once for 14 damage all on its own.

MVP honestly might have been Mr. Fantastic, as I was lucky and had three copies of ""Twisting Equations"" in the Dark Betrayal pile. That card is crazy; I had several turns with 10 or even 11 cards in hand. And with all the Undercover deck-thinning, in game 2 Player 2 only had 11 cards left in their deck."
,,3,BleshInTheFlesh,64,36,100,1st,Yes (6),6th,30 (5.5),1st,0 (8),2nd,3.333 (10),29.5,,28,16,Quake,Scarlet Witch,I did not play a second attempt.,I did not play a second attempt.,First attempt,4,4/5,Good Round
,,4,ClobberinTime & megablueJJ67,23,30,53,1st,Yes (6),1st,25 (11),1st,0 (8),9th,2.12 (3),28,,7,2,Human Torch,Quake,Human Torch,Quake,First attempt,4,4/5,We enjoyed this setup. Getting some powerful Mr. Fantastic cards (One Gigantic Hand) can in handy for building powerful attacks lol.
,,5,Astigmatic_Oracle,58,34,92,1st,Yes (6),8th,31 (3.5),1st,0 (8),3rd,2.968 (9),26.5,,24,6,Darkhawk,The Warriors Three,Darkhawk,The Warriors Three,First attempt,4,4/5,"First game I got lucky with the twists, second game not so much."
,,6,Zhoud,30,35,65,1st,Yes (6),2nd,26 (10),8th,1 (3.5),7th,2.5 (5),24.5,,5,5,Mockingbird,The Warriors Three,I did not play a second attempt.,I did not play a second attempt.,First attempt,3,3/5,Why does every Valkyrie card cost 1 more than it should? Getting Unstable Molecules off a turn 3 twist was very nice!
,,7,AntDude,61,35,96,1st,Yes (6),11th,35 (1),1st,0 (8),6th,2.743 (6),21,,26,11,Darkhawk,Lady Sif,Darkhawk,Lady Sif,First attempt,4,4/5,"A fun setup with the right Mr. Fantastic cards going to the right decks. Darkhawk and Deathlock paired so well, and Sif’s winged helm helped a lot to prevent wounds from twists and strikes."
,,8,GamerGump & kendycrow,24,64,88,1st,Yes (6),8th,31 (3.5),8th,1 (3.5),5th,2.839 (7),20,,40,5,Agent Phil Coulson,The Warriors Three,Agent Phil Coulson,The Warriors Three,First attempt,5,5/5,Colson + Mr Fantastic + invisible woman rare = whole deck in your hand. Fun times.
,,9,SilverGetzu & BanditBee,36,43,79,1st,Yes (6),10th,34 (2),1st,0 (8),8th,2.324 (4),20,,7,3,Silver Surfer,Agent Phil Coulson,I did not play a second attempt.,I did not play a second attempt.,First attempt,4,4/5,"Surprisingly, the MVP of the game was Mr.Fantastic. Some lucky early scheme twists (odd statement) led to early mr fantastic draw abilities, leading to fairly consistent 7-10 card hands. Took some time to close out still but lots of fun with crazy combos."
,,10,MrTInce,36,21,57,1st,Yes (6),3rd,27 (9),10th,3 (2),10th,2.111 (2),19,,15,2,Mockingbird,Lady Sif,Mockingbird,Lady Sif,First attempt,3,3/5,Keeping the city controlled was hard as rings coming back into the city pushing things around.
,,11,Coldvein & Raja0629,20,20,40,1st,Yes (6),5th,29 (7),11th,7 (1),11th,1.379 (1),15,,0,1,Thing,Agent Phil Coulson,Thing,Photon,Second attempt,4,4/5,Nice challenge for both playthroughs.
5,Onslaught Splices Humans with Spider DNA,1,Grey Warden & Blue Queen,29,48,77,1st,Yes (8.5),2nd,37 (8),1st,0 (9),1st,2.081 (9),34.5,,19,7,Groot,Spider-Woman,Groot,Spider-Woman,Second attempt,4,4/5,"In our first attempt, the Heroes worked out really well but we ran out of Villain Deck before we got all the tactics. The second game we got Gamora's rare for 5 Attack thanks to Random and she blasted Onslaught away. Grey (Hand 1) had Berserk and Queen (2) had Shards. Very good combos. Also, Groot and Spider-Woman and Cannonball are great counters too Onslaught's Gimpy Hand nerf."
,,2,GZUZROCKS & MyBestPardner,28,43,71,1st,Yes (8.5),1st,36 (9),2nd,2 (8),2nd,1.972 (8),33.5,,15,3,Drax the Destroyer,X-23,Drax the Destroyer,X-23,First attempt,3,3/5,This was TOUGH! Onslaught will now commence to give me nightmares. lol.
,,3,Lasombra81,18,28,46,3rd,No (4),4th,39 (5.5),3rd,3 (6.5),4th,1.179 (6),22,,10,2,Groot,Star-Lord,Groot,Star-Lord,First attempt,2,2/5,Oof
,,4,NukinFoobs & N3m3sis,26,37,63,3rd,No (4),6th,38 (4),3rd,3 (6.5),3rd,1.658 (7),21.5,,11,8,Groot,Jubilee,Groot,Jubilee,First attempt,1,1/5,Our first game we weren't able to move quick enough to take out Onslaught. Then game 2 pretty much everything that could go wrong did lol. Still haven't defeated Onslaught with randomized setups
,,5,Loconnole & Klcgolf,10,28,38,3rd,No (4),4th,39 (5.5),5th,5 (5),5th,0.974 (5),19.5,,18,1,Legion,Groot,Psylocke,Banshee,Second attempt,1,1/5,This was pretty much unwinnable. Onslaught is incredibly tough himself and the heroes were tough to synergize
,,6,Canis & Mamabird,19,12,31,3rd,No (4),3rd,41 (7),8th,8 (2),7th,0.756 (3),16,,7,2,Banshee,Star-Lord,Banshee,Star-Lord,First attempt,2,2/5,"tried to use Star-Lord to get around the five car penalty, but had to much trouble recruiting at the beginning by the time i got anything going it was to late. had Banshee on the other side trying to help Havok, but had the same issues. lack of k.O. opportunity hurt as well, had 4 grey in the K.O. pile at the end, technically they were on Onslaught, the one tactic we saw in two games :("
,,7,nate the dawg & Emily,19,6,25,3rd,No (4),7th,34 (3),6th,6 (3.5),8th,0.735 (2),12.5,,13,4,Drax the Destroyer,Psylocke,Drax the Destroyer,Kitty Pryde,First attempt,4,4/5,"Well, it's not saying much, but that was the longest I've ever lasted against Onslaught!  The city was flooded with Sinister Six villains from the beginning, so we were just fighting the inevitable.  Onslaught's master strike is a real killer!"
,,8,SilverFirePrime,17,7,24,3rd,No (4),9th,25 (1),6th,6 (3.5),6th,0.96 (4),12.5,,10,1,Aurora & Northstar,Legion,Aurora & Northstar,Legion,First attempt,1,1/5,"If I wrote how I truly felt about these two games, I would somehow manage to violate the terms of service of every service available on the internet"
,,9,sethlikespizza & heheheath,11,10,21,3rd,No (4),8th,31 (2),9th,10 (1),9th,0.677 (1),8,,1,1,Moon Knight,Drax the Destroyer,Moon Knight,Drax the Destroyer,Second attempt,1,1/5,"This setup was not fun at all. There was literally nothing we could do against the combination of the domination effect, the 1 less max hand size, and the +3 buff to sinister six villains..."
,,-,joeydungee,-,-,-,-,-,-,-,-,-,-,-,-,-,-,-,-,-,-,-,-,,-,-
6,Macho Gomez' Sniper Rifle Assassins,1,R3DJ0N,36,30,66,1st,Yes (5),1st,18 (9),1st,0 (5),1st,3.667 (9),28,,6,4,Angel,Wolverine (X-Force),Angel,Wolverine (X-Force),First attempt,5,5/5,First attempt was very lucky. 2nd attempt was a little slower. Evasive acrobatics into Light the way worked out beautifully. So my hero choices didn't actually help much since BW and Photon did most of the work. The other side absorbed most of the wounds with Deadpool and even hit the MM once. Player 2 mainly kept the city clear.
,,2,Lamertien,59,21,80,1st,Yes (5),2nd,25 (8),1st,0 (5),3rd,3.2 (7),25,,38,10,Angel,Falcon & Winter Soldier,Angel,Falcon & Winter Soldier,Second attempt,4,4/5,"Good and a rather easy game to start with! Macho Gomez is much nastier when playing Advanced Solo. When I saw the given heroes I immediately knew, Angel would fit here perfectly! Deadpool for the Wounds, Photon & Angel for my ""discard""-Engine, but Black Widow had no good paring yet. So I added the partners Falcon & Wintersoldier for some more Dark Memories. I'm very pleased with my selections! :)"
,,3,CombatantMoth & QueenKate34,79,21,100,1st,Yes (5),4th,30 (6),1st,0 (5),2nd,3.333 (8),24,,58,15,Angel,Quicksilver,Angel,Quicksilver,Second attempt,5,5/5,"Angel, Photon, S.H.I.E.L.D. Black Widow and Quicksilver are deadly together!"
,,4,Jerzin,45,48,93,1st,Yes (5),5th,32 (4.5),1st,0 (5),5th,2.906 (4.5),19,,3,5,Punisher,Angel,I did not play a second attempt.,I did not play a second attempt.,First attempt,4,4/5,"Really KOed deck, when Player two using Light the Way and discarding card to boost the attack and kill henchmen and MM. Player one using Punisher and BW to kill the Deadpool's friend. Funny setup, but with all the KOing you never know when the top card of your deck will be non grey card. Fun setup!"
,,5,snash108 & SBPKECN,43,50,93,1st,Yes (5),5th,32 (4.5),1st,0 (5),5th,2.906 (4.5),19,,7,7,Falcon & Winter Soldier,White Tiger,Falcon & Winter Soldier,White Tiger,Second attempt,4,4/5,"SBPKECN managed to pull off an infinite with a six card deck, after attacking a Weasel in the city, grabbing Photon's uncommon from me, and using a dodge ability! That was what I was aiming for, but she was super proud to pull that off. Especially after losing the copy she purchased to a sniper rifle assassin 5 turns prior!"
,,6,Techfiend,33,32,65,1st,Yes (5),3rd,26 (7),1st,0 (5),8th,2.5 (2),19,,1,3,Darkhawk,Falcon & Winter Soldier,Darkhawk,Falcon & Winter Soldier,Second attempt,4,4/5,"Hyperspeed and Dark Memories worked well together with the double cards from Falcon and Winter Soldier on the left side. Right side went BW/Photon and used Dodge to drive Photon's Light the Way for big hits. Never played this scheme before, but it sucked. Burned 5 non-grey heroes on 3 twists, didn't see enough grey heroes there."
,,7,Avataristche,75,27,102,1st,Yes (5),7th,33 (2.5),1st,0 (5),4th,3.091 (6),18.5,,48,9,"Captain Marvel, Agent of SHIELD",Angel,"Captain Marvel, Agent of SHIELD",Angel,First attempt,3,3/5,The plan kinda worked?
,,8,orbrover,54,37,91,1st,Yes (5),7th,33 (2.5),1st,0 (5),7th,2.758 (3),15.5,,17,10,Slapstick,Solo,Slapstick,Solo,First attempt,4,4/5,"Quit sniping my rares, Macho! lol"
,,9,Pervavita & CatSwiftie,51,27,78,1st,Yes (5),9th,34 (1),1st,0 (5),9th,2.294 (1),12,,24,4,Quicksilver,Falcon & Winter Soldier,Quicksilver,Falcon & Winter Soldier,First attempt,3,3/5,Had fun. Thanks for setting this up
,,-,Adrian Miller,-,-,-,-,-,-,-,-,-,-,-,-,-,-,-,-,-,-,-,-,,-,-
7,Mysterio Breaks the Planet Asunder,1,JustHarold,32,50,82,1st,Yes (6),2nd,25 (8),1st,0 (8.5),3rd,3.28 (7),29.5,,18,7,Phyla-Vell,Nova (Avengers),I did not play a second attempt.,I did not play a second attempt.,First attempt,3,3/5,pretty easy. hit 3 master strikes super early sadly
,,2,Ashyy,67,19,86,1st,Yes (6),3rd,26 (7),3rd,1 (6),2nd,3.308 (8),27,,48,6,Doctor Voodoo,The Ancient One,Doctor Voodoo,The Ancient One,Second attempt,3,3/5,There’s some pretty good combos with scarlet spider and an x student sidekick.. Iykyk 🤷🏽‍♂️
